{
  "version": 1,
  "purpose": "Machine-readable resolution index for durable non-asset project authorities referenced by asset dependencies. AST-* remains the production-asset namespace; descriptive prose gates remain outside this registry until a unique controlling authority exists.",
  "exact_authorities": [
    {
      "id": "ATLAS-ARCH-001",
      "namespace": "ATLAS",
      "kind": "architecture",
      "status": "foundation",
      "source": {
        "provider": "google_drive",
        "file_id": "1-JMq4IEsSKSdvLfzHDmCajh2YDPwXaWGh7_GHsPT3oY",
        "title": "Aramyst — World Atlas Architecture v0.1"
      }
    },
    {
      "id": "ATLAS-REG-DATA-001",
      "namespace": "ATLAS",
      "kind": "register",
      "status": "active",
      "source": {
        "provider": "google_drive",
        "file_id": "1IIPWSEa81LMOaAzN-LYOtGzuILF5hxHgrtIGkqaOwpg",
        "title": "Aramyst — MAP-REG-001 Geographic Truth Layer — GEO & ROUTE Records v0.1"
      }
    },
    {
      "id": "MAP-ENV-001",
      "namespace": "MAP",
      "kind": "map_product",
      "status": "approved",
      "implemented_by_asset_id": "AST-MAP-003",
      "identity_rule": "distinct_from_asset",
      "source": {
        "provider": "google_drive",
        "file_id": "1w4UnjQpzTHQIE4UXpMrejuaKBLy6Y0XMSh6EiGx3nfg",
        "title": "Aramyst — MAP-ENV-001 Local Geometry Foundation & Spatial Approval Gate v0.1"
      },
      "notes": "MAP-ENV-001 is the durable map-product authority. AST-MAP-003 is the separate production asset implementing the approved local schematic."
    },
    {
      "id": "MAP-ENV-001-FOUND-001",
      "namespace": "MAP",
      "kind": "foundation",
      "status": "approved",
      "source": {
        "provider": "google_drive",
        "file_id": "1w4UnjQpzTHQIE4UXpMrejuaKBLy6Y0XMSh6EiGx3nfg",
        "title": "Aramyst — MAP-ENV-001 Local Geometry Foundation & Spatial Approval Gate v0.1"
      }
    },
    {
      "id": "MAP-ENV-001-QA-001",
      "namespace": "MAP",
      "kind": "qa",
      "status": "approved",
      "source": {
        "provider": "google_drive",
        "file_id": "1MDOXkIeBrNNkeafJUpqfpyp41PiiIaTkc5Ci7TR7oeI",
        "title": "Aramyst — MAP-ENV-001 Controlled Local Schematic Approval & QA v0.1"
      }
    },
    {
      "id": "MAP-HOU-001-CTRL-001",
      "namespace": "MAP",
      "kind": "decision",
      "status": "approved",
      "source": {
        "provider": "google_drive",
        "file_id": "1J62x1iu0bI5mud9WL1V46m96_0f0j5ct0PMazixn3pU",
        "title": "Aramyst — MAP-HOU-001 Controlling Topology & Floorplan Authorization v0.1"
      }
    },
    {
      "id": "MAP-HOU-001-FP-GD-001",
      "namespace": "MAP",
      "kind": "geometry_register",
      "status": "approved",
      "source": {
        "provider": "google_drive",
        "file_id": "1w7fd-wkY8ui2_mV6GO4N78lQWpTxDi55jTG0aeITmV4",
        "title": "Aramyst — MAP-HOU-001 FP01 Candidate Geometry Approval Register v0.1"
      }
    },
    {
      "id": "MAP-HOU-001-FP01-R1-QA-001",
      "namespace": "MAP",
      "kind": "qa",
      "status": "approved",
      "source": {
        "provider": "google_drive",
        "file_id": "13vGwovr1KA8SlX5MYEbUdiYMqz3QEogu2ziaxAScEB8",
        "title": "Aramyst — MAP-HOU-001 FP01-R1 Floorplan QA v0.1"
      }
    },
    {
      "id": "HOU-PD-012",
      "namespace": "HOU",
      "kind": "decision_record",
      "status": "deferred_governing",
      "source": {
        "provider": "google_drive",
        "file_id": "1J62x1iu0bI5mud9WL1V46m96_0f0j5ct0PMazixn3pU",
        "title": "Aramyst — MAP-HOU-001 Controlling Topology & Floorplan Authorization v0.1"
      }
    },
    {
      "id": "REL-CHAP-HOUSE-001",
      "namespace": "REL",
      "kind": "canon_document",
      "status": "canon",
      "source": {
        "provider": "google_drive",
        "file_id": "1Tjjur8sz34PmKjUS4oaxVkJJspJPBEcz4Ru-mMj9sJM",
        "title": "Aramyst — Last-Bell House (REL-CHAP-HOUSE-001)"
      }
    },
    {
      "id": "SCN-NODE-001",
      "namespace": "SCN",
      "kind": "scenario_register",
      "status": "governing_design_reference",
      "source": {
        "provider": "google_drive",
        "file_id": "17JXqyxxPqa5odbHUm92KaMygG_AmrqLJp9xnTkJP52w",
        "title": "Aramyst — SCN-INV-001 Investigation Node Map (SCN-NODE-001)"
      }
    }
  ],
  "authority_ranges": [
    {
      "prefix": "GEO",
      "namespace": "GEO",
      "start": 2,
      "end": 10,
      "width": 6,
      "source_authority_id": "ATLAS-REG-DATA-001"
    },
    {
      "prefix": "ROUTE",
      "namespace": "ROUTE",
      "start": 1,
      "end": 7,
      "width": 6,
      "source_authority_id": "ATLAS-REG-DATA-001"
    },
    {
      "prefix": "GXR",
      "namespace": "GXR",
      "start": 1,
      "end": 16,
      "width": 6,
      "source_authority_id": "ATLAS-REG-DATA-001"
    },
    {
      "prefix": "ENV-SD",
      "namespace": "ENV",
      "start": 1,
      "end": 7,
      "width": 3,
      "source_authority_id": "MAP-ENV-001-FOUND-001"
    },
    {
      "prefix": "ENV-GD",
      "namespace": "ENV",
      "start": 1,
      "end": 10,
      "width": 3,
      "source_authority_id": "MAP-ENV-001-FOUND-001"
    },
    {
      "prefix": "HOU-FP-GD",
      "namespace": "HOU",
      "start": 1,
      "end": 22,
      "width": 3,
      "source_authority_id": "MAP-HOU-001-FP-GD-001"
    }
  ]
}
